{
  "$schema": "../../resources/schemas/scene.json",
  "materials": [
    {
      "name": "sponge",
      "type": "node",
      "shader": {
        "diffuse_output": "colorRamp.color",
        "nodes": {
          "intersection_info": {
            "type": "intersection_info"
          },
          "voronoi":{
              "type":"voronoi_texture",
              "inputs": {
                "uv": "intersection_info.uv"
              },
              "size": 30
            },
          "voronoi2":{
              "type":"voronoi_texture",
              "inputs": {
                "uv": "intersection_info.uv"
              },
              "size": 20
            },
          "mult":{
            "type":"binary_math",
            "op":"multiplication",
            "inputs": {
              "lhs": "voronoi.factor",
              "rhs": "voronoi2.factor"
            }
          },
          "colorRamp": {
            "type": "color_ramp",
            "inputs": {
              "value": "mult.result"
            },
            "stops": [
              { "value": 0.0, "color": [0.3, 0.3, 0.0] },
              { "value" : 1.0, "color": [1.0, 1.0, 0.0] }
            ]
          }
        }
      }
    }
],
"camera": {
  "position": [
    0.0,
    0.0,
    0.0
  ],
  "focus": [
    2.0,
    0.0,
    0.0
  ],
  "up": [
    0.0,
    0.0,
    1.0
  ],
  "fov": 1.5,
  "aspectRatio": 1.78,
  "zmin": 0.5
},
"lights": [
  {
    "type": "ambientLight",
    "color": [
      1.0,
      1.0,
      1.0
    ]
  }
],
"objects": [
  {
    "type": "triangle",
    "points": [
      [
        2.0,
        -1.0,
        1.0
      ],
      [
        2.0,
        1.0,
        1.0
      ],
      [
        2.0,
        -1.0,
        -1.0
      ]
    ],
    "uvMap": [
      [
        0.0,
        0.0
      ],
      [
        1.0,
        0.0
      ],
      [
        0.0,
        1.0
      ]
    ],
    "material": "double_voronoi"
  },
  {
    "type": "triangle",
    "points": [
      [
        2.0,
        1.0,
        1.0
      ],
      [
        2.0,
        1.0,
        -1.0
      ],
      [
        2.0,
        -1.0,
        -1.0
      ]
    ],
    "uvMap": [
      [
        1.0,
        0.0
      ],
      [
        1.0,
        1.0
      ],
      [
        0.0,
        1.0
      ]
    ],
    "material": "double_voronoi"
  }
]
}