{
    "materials": [
        {
            "name": "lightBlue",
            "type": "uniform",
            "diffuse": [0.5, 0.5, 0.7],
            "specular": [0.0, 0.0, 0.0],
            "specularSpread": 1.0,
            "reflectivity": [0.0, 0.0, 0.0]
        },
        {
            "name": "lightGrey",
            "type": "uniform",
            "diffuse": [0.8, 0.8, 0.8],
            "specular": [0.0, 0.0, 0.0],
            "specularSpread": 1.0,
            "reflectivity": [1.0, 1.0, 1.0]
        },
        {
            "name": "orange",
            "type": "uniform",
            "diffuse": [1.0, 0.5, 0.1],
            "specular": [0.0, 0.0, 0.0],
            "specularSpread": 1.0,
            "reflectivity": [0.0, 0.0, 0.0]
        },
        {
            "name": "red",
            "type": "uniform",
            "diffuse": [0.9, 0.2, 0.2],
            "specular": [0.1, 0.1, 0.1],
            "specularSpread": 0.8,
            "reflectivity": [0.05, 0.05, 0.05]
        }
    ],
    "camera": {
        "position": [0.0, 0.0, 0.0],
        "focus": [4.0, 0.0, 0.0],
        "up": [0.0, 0.0, 1.0],
        "fov" : 1.5,
        "aspectRatio" : 1.78,
        "zmin" : 0.5
    },
    "lights" : [
        {
            "type": "ambientLight",
            "color": [0.15, 0.15, 0.15]
        },
        {
            "type": "pointLight",
            "position": [0.0, 0.0, 3.0],
            "intensity" : [0.8, 0.8, 0.8]
        },
        {
            "type": "sunLight",
            "direction": [0.5, -1, -1],
            "color": [0.8, 0.8, 0.6]
        }
    ],
    "objects" : [
        {
            "type": "plane",
            "reference": [20.0, 0.0, 0.0],
            "normal": [-1.0, 0.0, 0.0],
            "material": "lightBlue"
        },
        {
            "type": "plane",
            "reference": [0.0, 0.0, -1.0],
            "normal": [0.0, 0.0, 1.0],
            "material": "lightGrey"
        },
        {
            "type": "sphere",
            "center": [4.0, -1.0, 1.0],
            "radius": 0.5,
            "material": "orange"
        },
        {
            "type": "triangle",
            "points": [
                [2.0, 1.0, 1.0],
                [2.0, 0.0, 1.0],
                [2.0, 1.0, 0.0]
            ],
            "material": "red"
        }
    ]
}
