{
  "$schema": "../../resources/schemas/scene.json",
  "materials": [
    {
      "name": "procTex",
      "type": "node",
      "shader": {
        "diffuse_output": "colorRamp.color",
        "nodes": {
          "intersection_info": {
            "type": "intersection_info"
          },
          "noise":{
            "type":"fractal_noise_texture",
            "scale": 1.5,
            "octaves": 25,
            "inputs": {
              "uv": "intersection_info.uv"
            }
          },
          "noised_vec2": {
            "type":"construct_planar",
            "inputs": {
              "x":"noise.factor",
              "y":"noise.factor"
            }
          },
          "voronoi":{
            "type":"voronoi_texture",
            "inputs": {
              "uv": "intersection_info.uv"
            },
            "size": 40
          },
          "colorRamp": {
            "type": "color_ramp",
            "inputs": {
              "value": "voronoi.factor"
            },
            "stops": [
              { "value": 0.0, "color": [1.0, 1.0, 1.0] },
              { "value" : 1.0, "color": [0.0, 0.0, 1.0] }
            ]
          }
        }
      }
    }
],
"camera": {
  "position": [
    0.0,
    0.0,
    0.0
  ],
  "focus": [
    2.0,
    0.0,
    0.0
  ],
  "up": [
    0.0,
    0.0,
    1.0
  ],
  "fov": 1.5,
  "aspectRatio": 1.78,
  "zmin": 0.5
},
"lights": [
  {
    "type": "ambientLight",
    "color": [
      1.0,
      1.0,
      1.0
    ]
  }
],
"objects": [
  {
    "type": "triangle",
    "points": [
      [
        2.0,
        -1.0,
        1.0
      ],
      [
        2.0,
        1.0,
        1.0
      ],
      [
        2.0,
        -1.0,
        -1.0
      ]
    ],
    "uvMap": [
      [
        0.0,
        0.0
      ],
      [
        1.0,
        0.0
      ],
      [
        0.0,
        1.0
      ]
    ],
    "material": "procTex"
  },
  {
    "type": "triangle",
    "points": [
      [
        2.0,
        1.0,
        1.0
      ],
      [
        2.0,
        1.0,
        -1.0
      ],
      [
        2.0,
        -1.0,
        -1.0
      ]
    ],
    "uvMap": [
      [
        1.0,
        0.0
      ],
      [
        1.0,
        1.0
      ],
      [
        0.0,
        1.0
      ]
    ],
    "material": "procTex"
  }
]
}